{
  "dotNotation": "2.16.840.1.113883.2.16.3.1.21.3.2.5",
  "category": "codingscheme",
  "symbolicName": "pn-other-ob-units",
  "status": "pending",
  "description": [
    {
      "lang": "de",
      "text": "PräNUDGE Andere Observations Einheiten"
    },
    {
      "lang": "en",
      "text": "PreNUDGE Other Observations Units"
    }
  ],
  "registrationAuthority": "JOANNEUM RESEARCH Forschungsgesellschaft mbH",
  "responsibleAuthority": {
    "person_name": "Theresa Weitlaner",
    "organization_name": "JOANNEUM RESEARCH Forschungsgesellschaft mbH",
    "organization_telecom": "theresa.weitlaner@joanneum.at"
  },
  "creationDate": "2026-07-15",
  "lastmodifiedDate": "2026-07-15T12:07:35.072Z",
  "link_uri": "https://fhir.hl7.at/r4-JoanneumResearch-PreNUDGE-AppData-main/ValueSet-prenudge-other-observations-units.html"
}
