{
  "dotNotation": "2.16.840.1.113883.2.16.3.1.21.3.1.1",
  "category": "codingscheme",
  "symbolicName": "pn-whoqol-bref-scale",
  "status": "pending",
  "description": [
    {
      "lang": "de",
      "text": "PräNUDGE WHOQOL-BREF Antwortoptionen"
    },
    {
      "lang": "en",
      "text": "PreNUDGE WHOQOL-BREF Answer Scales"
    }
  ],
  "registrationAuthority": "JOANNEUM RESEARCH Forschungsgesellschaft mbH",
  "responsibleAuthority": {
    "person_name": "Theresa Weitlaner",
    "organization_name": "JOANNEUM RESEARCH Forschungsgesellschaft mbH",
    "organization_telecom": "theresa.weitlaner@joanneum.com"
  },
  "creationDate": "2026-07-14",
  "lastmodifiedDate": "2026-07-14",
  "link_uri": "https://fhir.hl7.at/r4-JoanneumResearch-PreNUDGE-AppData-main/CodeSystem-whoqol-bref-scale.html"
}
